{
  "$schema": "https://json-schema.org/draft/2020-12/schema",
  "$id": "https://schema.evideris.com/derived/schemas/release.schema.json",
  "title": "Release manifest (derived)",
  "type": "object",
  "required": ["$id", "type", "release", "releasedAt", "publisher", "license", "source", "_meta"],
  "properties": {
    "$schema":   { "type": "string", "format": "uri" },
    "$id":       { "type": "string", "format": "uri" },
    "type":      { "const": "release" },
    "release":   { "$ref": "_common.schema.json#/$defs/calverRelease" },
    "releasedAt":{ "type": "string", "format": "date" },
    "publisher": { "type": "string" },
    "license":   { "type": "string" },
    "source":    { "type": "string", "format": "uri" },
    "alignsWithSourceCanonicalRelease": { "$ref": "_common.schema.json#/$defs/calverRelease" },
    "competencies":          { "type": "array", "items": { "$ref": "#/$defs/artifactRef" } },
    "epas":                  { "type": "array", "items": { "$ref": "#/$defs/artifactRef" } },
    "evidenceCriteria":      { "type": "array", "items": { "$ref": "#/$defs/artifactRef" } },
    "competencyAssessments": { "type": "array", "items": { "$ref": "#/$defs/artifactRef" } },
    "catRecommendationMaps": { "type": "array", "items": { "$ref": "#/$defs/artifactRef" } },
    "scoringTools":          { "type": "array", "items": { "$ref": "#/$defs/artifactRef" } },
    "minorBumps": { "type": "array", "items": { "type": "string" } },
    "majorBumps": { "type": "array", "items": { "type": "string" } },
    "patchBumps": { "type": "array", "items": { "type": "string" } },
    "_meta": {
      "description": "Authorship/provenance of the release manifest itself. For a multi-curriculum assembly, derived_from lists every represented source-canonical curriculum; member artifacts retain their own provenance and rights.",
      "$ref": "_common.schema.json#/$defs/metaBlock"
    }
  },
  "additionalProperties": false,
  "$defs": {
    "artifactRef": {
      "type": "object",
      "required": ["lineageId", "version", "path", "sha256"],
      "properties": {
        "lineageId": { "$ref": "_common.schema.json#/$defs/lineageId" },
        "version":   { "$ref": "_common.schema.json#/$defs/semverString" },
        "path":      { "type": "string", "pattern": "^derived/[A-Za-z0-9._/-]+\\.json$" },
        "sha256":    { "type": "string", "pattern": "^[a-f0-9]{64}$" }
      },
      "additionalProperties": false
    }
  }
}
