{
  "$schema": "https://schema.evideris.com/derived/schemas/release.schema.json",
  "$id": "https://schema.evideris.com/derived/releases/r2026.07.json",
  "type": "release",
  "release": "r2026.07",
  "releasedAt": "2026-07-01",
  "publisher": "Evideris Systems BV",
  "license": "CC-BY-NC-SA-4.0",
  "source": "https://github.com/Evideris-Systems/evideris-curriculum-derived",
  "alignsWithSourceCanonicalRelease": "r2026.07",
  "competencies": [
    {
      "lineageId": "c-emr-cln-basic-colonoscopy-prereq",
      "version": "1.0.0",
      "path": "derived/competency/emr-cln/basic-colonoscopy-prereq.v1.0.0.json",
      "sha256": "7a1cfc1a3f11fbed5b7e4d475bca5f0d4d7ae76a77bf55d0b76a63844e50c596"
    },
    {
      "lineageId": "c-emr-cln-bleeding-management",
      "version": "1.0.0",
      "path": "derived/competency/emr-cln/bleeding-management.v1.0.0.json",
      "sha256": "561cab3d8b15a528559bcecda49e3d72f78fc459d132197189b7b441133ea672"
    },
    {
      "lineageId": "c-emr-cln-hemostasis-prereq",
      "version": "1.0.0",
      "path": "derived/competency/emr-cln/hemostasis-prereq.v1.0.0.json",
      "sha256": "67ed323864139f681ff65551527e6b1de85cd5d1c864903f8bfc6cd2d631e2b4"
    },
    {
      "lineageId": "c-emr-cln-lesion-assessment",
      "version": "1.0.0",
      "path": "derived/competency/emr-cln/lesion-assessment.v1.0.0.json",
      "sha256": "20a9d24bbffa9eaca508f62f596406ae6305afbcbb965603a2e21650dd8bd068"
    },
    {
      "lineageId": "c-emr-cln-patient-consent-discussion",
      "version": "1.0.0",
      "path": "derived/competency/emr-cln/patient-consent-discussion.v1.0.0.json",
      "sha256": "d51cf76f98aebd975c4ed8b445f6fe3e8656362bf460c2ad48466ec9f9e184e5"
    },
    {
      "lineageId": "c-emr-cln-post-emr-defect-inspection",
      "version": "1.0.0",
      "path": "derived/competency/emr-cln/post-emr-defect-inspection.v1.0.0.json",
      "sha256": "fa5f2b9e2388876a530e024288bb55f9d9d99930a5d391404796798f461fd54e"
    },
    {
      "lineageId": "c-emr-cln-small-polypectomy-prereq",
      "version": "1.0.0",
      "path": "derived/competency/emr-cln/small-polypectomy-prereq.v1.0.0.json",
      "sha256": "bd58e45abeb88361d4c0a84a57093bf2faf586c44144b49f5cdfb7aa932de38b"
    },
    {
      "lineageId": "c-emr-cln-smi-risk-stratification",
      "version": "1.0.0",
      "path": "derived/competency/emr-cln/smi-risk-stratification.v1.0.0.json",
      "sha256": "9044094cde65f00d43e6c2087fdff7f0dbeb2f8b17a65ed05c693afe202400fe"
    },
    {
      "lineageId": "c-emr-cln-snare-capture",
      "version": "1.0.0",
      "path": "derived/competency/emr-cln/snare-capture.v1.0.0.json",
      "sha256": "1fdb9ccde89aa1ae51d2510ee0a34f2647284a78e7ea1442e2f0bef8a803e355"
    },
    {
      "lineageId": "c-emr-cln-submucosal-injection",
      "version": "1.0.0",
      "path": "derived/competency/emr-cln/submucosal-injection.v1.0.0.json",
      "sha256": "8d8ef7d40b7e3b08b0f06c57d431ea5f722848412ecb96f01e67a5dab12f6781"
    },
    {
      "lineageId": "c-emr-cln-thermal-margin-ablation",
      "version": "1.0.0",
      "path": "derived/competency/emr-cln/thermal-margin-ablation.v1.0.0.json",
      "sha256": "7bb66f532fa76e5c282a55499649b40d527671c842bcda0d9ea039cbbef96828"
    },
    {
      "lineageId": "c-esd-esd-theoretical-knowledge",
      "version": "1.0.0",
      "path": "derived/competency/esd/esd-theoretical-knowledge.v1.0.0.json",
      "sha256": "9da1da19e6229d913446f0f42d500c62cca2121cb45fd2cb6a5bf834c01d41f6"
    },
    {
      "lineageId": "c-esd-animal-model-esd",
      "version": "1.0.0",
      "path": "derived/competency/esd/animal-model-esd.v1.0.0.json",
      "sha256": "2aa3151b2d30188f152f8075a42504cb24f4321772610b2b81885264a21470a3"
    },
    {
      "lineageId": "c-esd-esd-adverse-event-management",
      "version": "1.0.0",
      "path": "derived/competency/esd/esd-adverse-event-management.v1.0.0.json",
      "sha256": "f4c151f0169ef7d0d3d54b7c530d64021bb0f11fc2bdaebcb35a6003e9dbb8bd"
    },
    {
      "lineageId": "c-esd-initial-human-esd-selection",
      "version": "1.0.0",
      "path": "derived/competency/esd/initial-human-esd-selection.v1.0.0.json",
      "sha256": "d6eccb25728ea962b508dbbdd32ea3babc4a05326b32d771c3b090b013955796"
    },
    {
      "lineageId": "c-esd-advanced-diagnostic-endoscopy",
      "version": "1.0.0",
      "path": "derived/competency/esd/advanced-diagnostic-endoscopy.v1.0.0.json",
      "sha256": "49b50baa4185ea667a23985cda7e04381596a3ca0488d551ab0305af1898777c"
    },
    {
      "lineageId": "c-esd-emr-proficiency-prereq",
      "version": "1.0.0",
      "path": "derived/competency/esd/emr-proficiency-prereq.v1.0.0.json",
      "sha256": "fc65a2f2e451556aa922f39ac7bf1ff427e4ec046b8b4ec809aa6a8cee8ed2f8"
    },
    {
      "lineageId": "c-esd-supervised-first-human-esd",
      "version": "1.0.0",
      "path": "derived/competency/esd/supervised-first-human-esd.v1.0.0.json",
      "sha256": "89897e247bf11fca875c550a8bd131c591158010691610db13c9fe4aa660e17c"
    },
    {
      "lineageId": "c-esd-supervised-observation-assist",
      "version": "1.0.0",
      "path": "derived/competency/esd/supervised-observation-assist.v1.0.0.json",
      "sha256": "91e356c2f93447a89a24527585d2203bcb021acdf963ae7de3f73638b459d3d4"
    },
    {
      "lineageId": "c-esd-curative-resection-estimation",
      "version": "1.0.0",
      "path": "derived/competency/esd/curative-resection-estimation.v1.0.0.json",
      "sha256": "065e38bf2d316ae5bba47757b66a23560abff484bcc8c54044b6cc2c303cb4e1"
    },
    {
      "lineageId": "c-esd-histopathology-interpretation",
      "version": "1.0.0",
      "path": "derived/competency/esd/histopathology-interpretation.v1.0.0.json",
      "sha256": "50475b54522c479a257ad8d3abf2895767d7b3d4f38da3cb6450f77c42fc2d36"
    },
    {
      "lineageId": "c-poem-2-case-selection",
      "version": "1.0.0",
      "path": "derived/competency/poem-2/case-selection.v1.0.0.json",
      "sha256": "7b4f2fabd493d37d5eabf8350a35d323c2b057be14c9834467b35a8273c21299"
    },
    {
      "lineageId": "c-poem-2-esophageal-cleansing",
      "version": "1.0.0",
      "path": "derived/competency/poem-2/esophageal-cleansing.v1.0.0.json",
      "sha256": "b4555f3bd76a818b92b1ecf5bb846d4946f06b720ce4053eefc374fd900186c4"
    },
    {
      "lineageId": "c-poem-2-gej-recognition",
      "version": "1.0.0",
      "path": "derived/competency/poem-2/gej-recognition.v1.0.0.json",
      "sha256": "9b91483879164408ce3a16521b44a8b69d2635bf319813c7ecb1558ac28f808f"
    },
    {
      "lineageId": "c-poem-2-intraprocedural-adverse-event-management",
      "version": "1.0.0",
      "path": "derived/competency/poem-2/intraprocedural-adverse-event-management.v1.0.0.json",
      "sha256": "0bdd619c0d710fc8b6fe0790e115255a6e79455857797653351fa56a937ceca3"
    },
    {
      "lineageId": "c-poem-2-mucosal-closure",
      "version": "1.0.0",
      "path": "derived/competency/poem-2/mucosal-closure.v1.0.0.json",
      "sha256": "20a1d33393533f30c8a22d656343ca95c111eb662ee740c26fd014dae15c25a6"
    },
    {
      "lineageId": "c-poem-2-mucosotomy",
      "version": "1.0.0",
      "path": "derived/competency/poem-2/mucosotomy.v1.0.0.json",
      "sha256": "3809350d1c9071cfba173367a2ccb82f58bd78d8c766235e8544988baf4a1922"
    },
    {
      "lineageId": "c-poem-2-myotomy-orientation-selection",
      "version": "1.0.0",
      "path": "derived/competency/poem-2/myotomy-orientation-selection.v1.0.0.json",
      "sha256": "b8163d3cf97b7b35a59b739dedb920701a4bf7d7015b6563dc8095f23c26a108"
    },
    {
      "lineageId": "c-poem-2-myotomy-technique",
      "version": "1.0.0",
      "path": "derived/competency/poem-2/myotomy-technique.v1.0.0.json",
      "sha256": "286308c9fde52f51bb372cb98f2065654d0e4cdc2bce1aa185b803ad577fc419"
    },
    {
      "lineageId": "c-poem-2-postoperative-care",
      "version": "1.0.0",
      "path": "derived/competency/poem-2/postoperative-care.v1.0.0.json",
      "sha256": "5d73ab98f1e270c1fdf98128b564a07745dc6e5dd3eb1620d060072557cf22e4"
    },
    {
      "lineageId": "c-poem-2-preprocedure-preparation",
      "version": "1.0.0",
      "path": "derived/competency/poem-2/preprocedure-preparation.v1.0.0.json",
      "sha256": "822407c6f83ee0d27dcf94eb8612dc6a96752a82da6cf9b0fd272ed3d397beb9"
    },
    {
      "lineageId": "c-poem-2-submucosal-injection",
      "version": "1.0.0",
      "path": "derived/competency/poem-2/submucosal-injection.v1.0.0.json",
      "sha256": "4c3e9ab053acebe25baf5142c87900f066cdfd6a6e865c68203e02b5a5ab5e34"
    },
    {
      "lineageId": "c-poem-2-submucosal-tunneling",
      "version": "1.0.0",
      "path": "derived/competency/poem-2/submucosal-tunneling.v1.0.0.json",
      "sha256": "f81272a431bfec4e37dd1d1f5f62c9d50840c8bd10be483ffdba8b1c030e3dd8"
    }
  ],
  "epas": [
    {
      "lineageId": "epa-emr-cln-independent-piecemeal",
      "version": "1.0.0",
      "path": "derived/epa/emr-cln/independent-piecemeal.v1.0.0.json",
      "sha256": "a181ae153d25b794c187d3934fc480b31026c699702af57ab423a0b52d3eb292"
    },
    {
      "lineageId": "epa-esd-independent-practice",
      "version": "1.0.0",
      "path": "derived/epa/esd/independent-esd-practice.v1.0.0.json",
      "sha256": "aa246548ce5013a1ad68ac76c675edc47c4a66394a0f5b6e1e680c4f66fe3dfe"
    },
    {
      "lineageId": "epa-poem-2-independent-practice",
      "version": "1.0.0",
      "path": "derived/epa/poem-2/independent-poem.v1.0.0.json",
      "sha256": "d83d9e734efd4f985b85b8345c9f29e0c2c256b830f4f0d27f0a8ca40ae12858"
    }
  ],
  "evidenceCriteria": [
    {
      "lineageId": "ec-emr-unit-anticoagulant-protocols",
      "version": "1.0.0",
      "path": "derived/evidence-criterion/emr-cln/anticoagulant-protocols-evidence.v1.0.0.json",
      "sha256": "9eb2f9407bb5711a89ed86ef664a18ce302ad0391c754d92c83bdf441de88d68"
    },
    {
      "lineageId": "ec-emr-unit-preprocedure-information",
      "version": "1.0.0",